<?xml version="1.0" encoding="UTF-8"?>
<!DOCTYPE employees [
  <!ELEMENT employees (employee+)>
  <!ELEMENT employee (id, name, position, department, salary)>
  <!ELEMENT id (#PCDATA)>
  <!ELEMENT name (#PCDATA)>
  <!ELEMENT position (#PCDATA)>
  <!ELEMENT department (#PCDATA)>
  <!ELEMENT salary (#PCDATA)>
]>
<employees>
  <employee>
    <id>1</id>
    <name>John Doe</name>
    <position>Software Engineer</position>
    <department>Engineering</department>
    <salary>80000</salary>
  </employee>
  <employee>
    <id>2</id>
    <name>Jane Smith</name>
    <position>Marketing Specialist</position>
    <department>Marketing</department>
    <salary>65000</salary>
  </employee>
  <employee>
    <id>3</id>
    <name>Alice Johnson</name>
    <position>HR Manager</position>
    <department>Human Resources</department>
    <salary>75000</salary>
  </employee>
  <employee>
    <id>4</id>
    <name>Bob Williams</name>
    <position>Accountant</position>
    <department>Finance</department>
    <salary>70000</salary>
  </employee>
  <employee>
    <id>5</id>
    <name>Michael Brown</name>
    <position>Operations Supervisor</position>
    <department>Operations</department>
    <salary>85000</salary>
  </employee>
  <employee>
    <id>6</id>
    <name>Susan Miller</name>
    <position>Customer Support Representative</position>
    <department>Customer Support</department>
    <salary>60000</salary>
  </employee>
  <employee>
    <id>7</id>
    <name>David Turner</name>
    <position>Quality Assurance Analyst</position>
    <department>Quality Assurance</department>
    <salary>72000</salary>
  </employee>
  <!-- Add more employee entries as needed -->
</employees>
